{
  "$schema": "https://json-schema.org/draft/2020-12/schema",
  "$id": "https://aictx.dev/schemas/v5/object.schema.json",
  "type": "object",
  "additionalProperties": false,
  "required": [
    "id",
    "type",
    "status",
    "title",
    "body_path",
    "content_hash",
    "created_at",
    "updated_at"
  ],
  "properties": {
    "id": {
      "type": "string",
      "pattern": "^[a-z][a-z0-9_]*\\.[a-z0-9][a-z0-9-]*$"
    },
    "type": {
      "enum": ["project", "feature", "decision", "gotcha", "question"]
    },
    "status": {
      "enum": ["active", "stale", "superseded", "open", "closed"]
    },
    "title": {
      "type": "string",
      "minLength": 1
    },
    "body_path": {
      "type": "string",
      "pattern": "^memory\\/.+\\.md$"
    },
    "stage": {
      "enum": ["idea", "building", "shipped", "paused", "dead"]
    },
    "anchors": {
      "type": "array",
      "items": {
        "type": "string",
        "minLength": 1
      },
      "uniqueItems": true
    },
    "tags": {
      "type": "array",
      "items": {
        "type": "string",
        "pattern": "^[a-z0-9][a-z0-9-]*$"
      },
      "uniqueItems": true
    },
    "evidence": {
      "type": "array",
      "items": {
        "type": "object",
        "additionalProperties": false,
        "required": ["kind", "id"],
        "properties": {
          "kind": {
            "enum": ["memory", "relation", "file", "commit", "task", "source"]
          },
          "id": {
            "type": "string",
            "minLength": 1
          }
        }
      }
    },
    "source": {
      "type": "object",
      "additionalProperties": false,
      "required": ["kind"],
      "properties": {
        "kind": {
          "enum": ["agent", "user", "cli", "mcp", "system"]
        },
        "task": {
          "type": "string"
        },
        "commit": {
          "type": "string",
          "minLength": 1
        }
      }
    },
    "origin": {
      "type": "object",
      "additionalProperties": false,
      "required": ["kind", "locator"],
      "properties": {
        "kind": {
          "enum": ["file", "url", "user", "external"]
        },
        "locator": {
          "type": "string",
          "minLength": 1
        },
        "captured_at": {
          "type": "string",
          "pattern": "^\\d{4}-\\d{2}-\\d{2}T\\d{2}:\\d{2}:\\d{2}(\\.\\d{1,9})?(Z|[+-]\\d{2}:\\d{2})$"
        },
        "digest": {
          "type": "string",
          "pattern": "^sha256:[a-f0-9]{64}$"
        },
        "media_type": {
          "type": "string",
          "minLength": 1
        }
      }
    },
    "superseded_by": {
      "type": ["string", "null"],
      "pattern": "^[a-z][a-z0-9_]*\\.[a-z0-9][a-z0-9-]*$"
    },
    "content_hash": {
      "type": "string",
      "pattern": "^sha256:[a-f0-9]{64}$"
    },
    "created_at": {
      "type": "string",
      "pattern": "^\\d{4}-\\d{2}-\\d{2}T\\d{2}:\\d{2}:\\d{2}(\\.\\d{1,9})?(Z|[+-]\\d{2}:\\d{2})$"
    },
    "updated_at": {
      "type": "string",
      "pattern": "^\\d{4}-\\d{2}-\\d{2}T\\d{2}:\\d{2}:\\d{2}(\\.\\d{1,9})?(Z|[+-]\\d{2}:\\d{2})$"
    }
  },
  "allOf": [
    {
      "if": {
        "properties": {
          "type": {
            "const": "question"
          }
        }
      },
      "then": {
        "properties": {
          "status": {
            "enum": ["stale", "superseded", "open", "closed"]
          }
        }
      },
      "else": {
        "properties": {
          "status": {
            "enum": ["active", "stale", "superseded"]
          }
        }
      }
    },
    {
      "if": {
        "properties": {
          "type": {
            "const": "feature"
          }
        }
      },
      "then": {},
      "else": {
        "not": {
          "required": ["stage"]
        }
      }
    }
  ]
}
