{
  "id": "gotcha.hashes-deterministic",
  "type": "gotcha",
  "status": "active",
  "title": "Fixture hashes must be deterministic",
  "body_path": "memory/gotchas/hashes-deterministic.md",
  "tags": [
    "fixture",
    "hashing"
  ],
  "source": {
    "kind": "agent",
    "task": "T044"
  },
  "superseded_by": null,
  "created_at": "2026-04-25T14:00:00+02:00",
  "updated_at": "2026-04-25T14:00:00+02:00",
  "content_hash": "sha256:9edac4ca111f5903c82e86d67d72637e817f1f97ea8fc17a88cd20f724523816"
}
