{
  "id": "question.fixture-refresh",
  "type": "question",
  "status": "open",
  "title": "When should fixtures be refreshed?",
  "body_path": "memory/questions/fixture-refresh.md",
  "tags": [
    "fixture"
  ],
  "source": {
    "kind": "agent",
    "task": "T044"
  },
  "superseded_by": null,
  "created_at": "2026-04-25T14:00:00+02:00",
  "updated_at": "2026-04-25T14:00:00+02:00",
  "content_hash": "sha256:9fad9bd5d5252744e8cea7924ead00491178a1fbc866019979e565cfba575d33"
}
